{
  "calibration_profile": null,
  "criteria": null,
  "domain": "harness.routing",
  "id": "route.too_thin",
  "instructions": "Is the work item in `title` too thin to place — too little said about what it touches or what kind of work it is for any workflow to be chosen with reason?",
  "note": "The router answers this deterministically as confidence :low, and the prompt hook then injects nothing. A model's answer is a second opinion on that silence.",
  "options": [],
  "type": "noul",
  "version": "1",
  "versions": [
    {
      "at": "2026-09-23",
      "fingerprint": "ae26dd303a52a0945ca01bbc93f3542cc5e2749e3e63dd2e6f021919ec2b167b",
      "version": "1",
      "why": "first version"
    }
  ]
}
